{
 "figram": 1,
 "conditions": {
  "c1": "c1",
  "c2": "c2",
  "c3": "c3"
 },
 "calls": {
  "k1": "k1",
  "k2": "k2"
 },
 "bot": {
  "initial": "S",
  "children": {
   "S": {
    "initial": "A",
    "children": {
     "A": {
      "on": {
       "btn:next": [
        {
         "to": "C"
        }
       ],
       "timer:nudge": [
        {
         "to": "R"
        }
       ]
      },
      "timers": {
       "nudge": 60000
      }
     },
     "C": {
      "on": {
       "btn:x": [
        {
         "to": "D"
        }
       ],
       "timer:remind": [
        {
         "to": "R"
        }
       ]
      }
     },
     "D": {},
     "E": {
      "timers": {
       "remind": 1
      }
     }
    }
   },
   "R": {}
  }
 }
}