{
 "figram": 1,
 "conditions": {
  "c1": "c1",
  "c2": "c2",
  "c3": "c3"
 },
 "calls": {
  "k1": "k1",
  "k2": "k2"
 },
 "bot": {
  "initial": "S",
  "children": {
   "S": {
    "initial": "A",
    "on": {
     "timer:remind": [
      {
       "to": "R",
       "do": [
        "k1"
       ]
      }
     ]
    },
    "children": {
     "A": {
      "on": {
       "btn:next": [
        {
         "to": "C"
        }
       ]
      }
     },
     "B": {
      "timers": {
       "remind": 60000
      }
     },
     "C": {
      "on": {
       "btn:x": [
        {
         "to": "D"
        }
       ]
      }
     },
     "D": {}
    }
   },
   "R": {}
  }
 }
}