{
 "figram": 1,
 "conditions": {
  "c1": "c1",
  "c2": "c2",
  "c3": "c3"
 },
 "calls": {
  "k1": "k1",
  "k2": "k2"
 },
 "bot": {
  "initial": "S",
  "on": {
   "btn:x": [
    {
     "to": "C"
    }
   ],
   "btn:w": [
    {
     "if": "c3",
     "to": "C"
    }
   ]
  },
  "children": {
   "S": {
    "initial": "m",
    "on": {
     "btn:x": [
      {
       "if": "c2",
       "to": "B"
      }
     ],
     "btn:y": [
      {
       "if": "c1",
       "to": "B"
      }
     ],
     "btn:z": [
      {
       "to": "B"
      }
     ]
    },
    "children": {
     "m": {
      "on": {
       "btn:x": [
        {
         "if": "c1",
         "to": "A"
        }
       ],
       "btn:y": [
        {
         "to": "A"
        }
       ]
      }
     },
     "A": {},
     "B": {}
    }
   },
   "C": {}
  }
 }
}